{"$schema":"https://json-schema.org/draft/2020-12/schema","type":"object","additionalProperties":false,"required":["schemaVersion","producerRepo","producerModule","producerCommit","generatedAt","caution","items"],"properties":{"schemaVersion":{"const":"anomaly_watchlist_v1"},"producerRepo":{"type":"string"},"producerModule":{"type":"string"},"producerCommit":{"type":"string"},"generatedAt":{"type":"string"},"caution":{"type":"string"},"items":{"type":"array","items":{"type":"object","additionalProperties":false,"required":["targetId","anomalyDomain","attackSurfaceClass","environmentIntegrityScore","evidenceMaturity","counterHypothesis","provenanceMarkers","uiClass"],"properties":{"targetId":{"type":"string"},"anomalyDomain":{"enum":["digital","social_behavioral","mixed"]},"attackSurfaceClass":{"enum":["platform","social","account","device","network"]},"environmentIntegrityScore":{"type":"number","minimum":0,"maximum":1},"evidenceMaturity":{"enum":["artifact","repeatable_test","independently_verified","conclusion_ready"]},"counterHypothesis":{"type":"object","additionalProperties":false,"required":["count","status"],"properties":{"count":{"type":"integer","minimum":0},"status":{"enum":["verify","watch","hold"]}}},"provenanceMarkers":{"type":"array","items":{"type":"string"}},"uiClass":{"enum":["subtle-info","subtle-critical"]}}}}}}
